<?xml version="1.0" encoding="UTF-8"?>

<!-- This file is part of the re-motion Core Framework (www.re-motion.org)
 ! Copyright (c) rubicon IT GmbH, www.rubicon.eu
 ! 
 ! The re-motion Core Framework is free software; you can redistribute it 
 ! and/or modify it under the terms of the GNU Lesser General Public License 
 ! as published by the Free Software Foundation; either version 2.1 of the 
 ! License, or (at your option) any later version.
 ! 
 ! re-motion is distributed in the hope that it will be useful, 
 ! but WITHOUT ANY WARRANTY; without even the implied warranty of 
 ! MERCHANTABILITY or FITNESS FOR A PARTICULAR PURPOSE. See the 
 ! GNU Lesser General Public License for more details.
 ! 
 ! You should have received a copy of the GNU Lesser General Public License
 ! along with re-motion; if not, see http://www.gnu.org/licenses.
-->
<urlMapping
    application="WxeTest"
    xmlns="http://www.re-motion.org/Web/ExecutionEngine/UrlMapping/1.0"
    xmlns:xsi="http://www.w3.org/2001/XMLSchema-instance"
    xsi:schemaLocation="http://www.re-motion.org/Web/ExecutionEngine/UrlMapping/1.0 UrlMapping.xsd">

  <add id="AnchorTest" type="Remotion.Web.Development.WebTesting.TestSite::AnchorTestFunction" resource="~/AnchorTest.wxe" />
  <add id="CommandTest" type="Remotion.Web.Development.WebTesting.TestSite::CommandTestFunction" resource="~/CommandTest.wxe" />
  <add id="DropDownListTest" type="Remotion.Web.Development.WebTesting.TestSite::DropDownListTestFunction" resource="~/DropDownListTest.wxe" />
  <add id="DropDownMenuTest" type="Remotion.Web.Development.WebTesting.TestSite::DropDownMenuTestFunction" resource="~/DropDownMenuTest.wxe" />
  <add id="ImageButtonTest" type="Remotion.Web.Development.WebTesting.TestSite::ImageButtonTestFunction" resource="~/ImageButtonTest.wxe" />
  <add id="InfrastructureTests" type="Remotion.Web.Development.WebTesting.TestSite::InfrastructureTestsFunction" resource="~/InfrastructureTests.wxe" />
  <add id="ListMenuTest" type="Remotion.Web.Development.WebTesting.TestSite::ListMenuTestFunction" resource="~/ListMenuTest.wxe" />
  <add id="TabbedMenuTest" type="Remotion.Web.Development.WebTesting.TestSite::TabbedMenuTestFunction" resource="~/TabbedMenuTest.wxe" />
  <add id="TabbedMultiViewTest" type="Remotion.Web.Development.WebTesting.TestSite::TabbedMultiViewTestFunction" resource="~/TabbedMultiViewTest.wxe" />
  <add id="TextBoxTest" type="Remotion.Web.Development.WebTesting.TestSite::TextBoxTestFunction" resource="~/TextBoxTest.wxe" />
  <add id="TreeViewTest" type="Remotion.Web.Development.WebTesting.TestSite::TreeViewTestFunction" resource="~/TreeViewTest.wxe" />
  <add id="WebButtonTest" type="Remotion.Web.Development.WebTesting.TestSite::WebButtonTestFunction" resource="~/WebButtonTest.wxe" />
  <add id="WebTabStripTest" type="Remotion.Web.Development.WebTesting.TestSite::WebTabStripTestFunction" resource="~/WebTabStripTest.wxe" />

  <add id="MultiWindowTest_Main" type="Remotion.Web.Development.WebTesting.TestSite::MultiWindowTest.MainFunction"
      resource="~/MultiWindowTest/Main.wxe" />
  <add id="MultiWindowTest_Frame" type="Remotion.Web.Development.WebTesting.TestSite::MultiWindowTest.FrameFunction"
      resource="~/MultiWindowTest/Frame.wxe" />
  <add id="MultiWindowTest_Window" type="Remotion.Web.Development.WebTesting.TestSite::MultiWindowTest.WindowFunction"
      resource="~/MultiWindowTest/Window.wxe" />
</urlMapping>