<?xml version="1.0" encoding="UTF-8" ?>
<!-- This file is part of re-strict (www.re-motion.org)
 ! Copyright (c) rubicon IT GmbH, www.rubicon.eu
 ! 
 ! This program is free software; you can redistribute it and/or modify
 ! it under the terms of the GNU Affero General Public License version 3.0 
 ! as published by the Free Software Foundation.
 ! 
 ! This program is distributed in the hope that it will be useful, 
 ! but WITHOUT ANY WARRANTY; without even the implied warranty of 
 ! MERCHANTABILITY or FITNESS FOR A PARTICULAR PURPOSE. See the 
 ! GNU Affero General Public License for more details.
 ! 
 ! You should have received a copy of the GNU Affero General Public License
 ! along with this program; if not, see http://www.gnu.org/licenses.
 ! 
 ! Additional permissions are listed in the file re-motion_exceptions.txt.
-->
<urlMapping
    xmlns="http://www.re-motion.org/Web/ExecutionEngine/UrlMapping/1.0" 
    xmlns:xsi="http://www.w3.org/2001/XMLSchema-instance"
    xsi:schemaLocation="http://www.re-motion.org/Web/ExecutionEngine/UrlMapping/1.0 UrlMapping.xsd">

  <add type="Remotion.SecurityManager.Clients.Web::WxeFunctions.OrganizationalStructure.EditTenantFormFunction" resource="EditTenant.wxe" />
  <add type="Remotion.SecurityManager.Clients.Web::WxeFunctions.OrganizationalStructure.EditGroupFormFunction" resource="EditGroup.wxe" />
  <add type="Remotion.SecurityManager.Clients.Web::WxeFunctions.OrganizationalStructure.EditUserFormFunction" resource="EditUser.wxe" />
  <add type="Remotion.SecurityManager.Clients.Web::WxeFunctions.OrganizationalStructure.EditGroupTypeFormFunction" resource="EditGroupType.wxe" />
  <add type="Remotion.SecurityManager.Clients.Web::WxeFunctions.OrganizationalStructure.EditPositionFormFunction" resource="EditPosition.wxe" />

  <add type="Remotion.SecurityManager.Clients.Web::WxeFunctions.OrganizationalStructure.TenantListFormFunction" resource="TenantList.wxe" id="TenantList"/>
  <add type="Remotion.SecurityManager.Clients.Web::WxeFunctions.OrganizationalStructure.GroupListFormFunction" resource="GroupList.wxe" id="GroupList"/>
  <add type="Remotion.SecurityManager.Clients.Web::WxeFunctions.OrganizationalStructure.UserListFormFunction" resource="UserList.wxe" id="UserList" />
  <add type="Remotion.SecurityManager.Clients.Web::WxeFunctions.OrganizationalStructure.GroupTypeListFormFunction" resource="GroupTypeList.wxe" id="GroupTypeList"/>
  <add type="Remotion.SecurityManager.Clients.Web::WxeFunctions.OrganizationalStructure.PositionListFormFunction" resource="PositionList.wxe" id="PositionList"/>

  <add type="Remotion.SecurityManager.Clients.Web::WxeFunctions.AccessControl.SecurableClassDefinitionListFormFunction" resource="SecurableClassDefinitionList.wxe" id="SecurableClassDefinitionList"/>
</urlMapping>

