<?xml version="1.0" encoding="UTF-8" ?>
<!-- This file is part of the re-motion Core Framework (www.re-motion.org)
 ! Copyright (c) rubicon IT GmbH, www.rubicon.eu
 ! 
 ! The re-motion Core Framework is free software; you can redistribute it 
 ! and/or modify it under the terms of the GNU Lesser General Public License 
 ! as published by the Free Software Foundation; either version 2.1 of the 
 ! License, or (at your option) any later version.
 ! 
 ! re-motion is distributed in the hope that it will be useful, 
 ! but WITHOUT ANY WARRANTY; without even the implied warranty of 
 ! MERCHANTABILITY or FITNESS FOR A PARTICULAR PURPOSE. See the 
 ! GNU Lesser General Public License for more details.
 ! 
 ! You should have received a copy of the GNU Lesser General Public License
 ! along with re-motion; if not, see http://www.gnu.org/licenses.
-->
<urlMapping
    application="WxeTest"
    xmlns="http://www.re-motion.org/Web/ExecutionEngine/UrlMapping/1.0"
    xmlns:xsi="http://www.w3.org/2001/XMLSchema-instance"
    xsi:schemaLocation="http://www.re-motion.org/Web/ExecutionEngine/UrlMapping/1.0 UrlMapping.xsd">
  <add type="Remotion.Web.Test::ExecutionEngine.SessionWxeFunction" resource="session.wxe"/>
  <add type="Remotion.Web.Test::ExecutionEngine.ProfilingWxeFunction" resource="prof.wxe"/>
  <add type="Remotion.Web.Test::ExecutionEngine.RedirectedWxeFunction" resource="redirected.wxe"/>
  <add type="Remotion.Web.Test::UpdatePanelTests.SutFunction" resource="UpdatePanelTests/Sut.wxe"/>
  <add type="Remotion.Web.Test::ExecutionEngine.ShowUserControlFormFunction" resource="ShowUserControl.wxe"/>
  <add type="Remotion.Web.Test::IFrameSupport.MainFunction" resource="Main.wxe"/>
  <add type="Remotion.Web.Test::IFrameSupport.FrameContentFunction" resource="FrameContent.wxe"/>
  <add type="Remotion.Web.Test::ExecutionEngine.ExceptionHandling.TestFunction" resource="ExceptionHandlingTest.wxe"/>
  <!--
		<add type="Remotion.Web.Test.SampleWxeFunction,Remotion.Web.Test" resource="sample.wxe"/>
		<add type="Remotion.Web.Test.SampleWxeFunction,Remotion.Web.Test" resource="sample_old.wxe"/>
-->

  <!--
		<add type="S8essionWxeFunction" resource="session.wxe1"/>
		<add type="SessionWxeFunction+C8lass" resource="session.wxe2"/>
		<add type="R8ubicon.PageTransition.S8essionWxeFunction+C8lass" resource="session.wxe3"/>
		<add type="Remotion.Web.Test.MultiplePostbackCatcherWxeFunction,Remotion.Web.Test" resource="mpc.wxe1"/>
		<add type="Remotion.Web.Test.MultiplePostbackCatcherWxeFunction+Class, Remotion.Web.Test" resource="mpc.wxe2"/>
		<add type="MultiplePostbackCatcherWxeFunction, Remotion.Web.Test" resource="mpc.wxe3"/>
		<add type="P8ageTransition::P8rofilingWxeFunction" resource="prof.wxe1"/>
		<add type="R8ubicon.PageTransition::P8rofilingWxeFunction" resource="prof.wxe2"/>
		<add type="R8ubicon.PageTransition::P8rofilingWxeFunction+C8lass" resource="prof.wxe3"/>
-->
</urlMapping>
